Date,Platform,Post Type,Content,Impressions,Engagement,Clicks,Conversions,UTM Source,UTM Medium,UTM Campaign,Notes
2025-01-15,LinkedIn,Post,5 Ways floyo Saves Solo Operators 10 Hours Per Week,1250,45,12,3,linkedin,organic,productivity,Posted at 9 AM ET
2025-01-15,Twitter,Thread,5 ways floyo saves solo operators 10 hours/week 🧵,890,32,8,2,twitter,organic,productivity,Posted at 10 AM ET
2025-01-16,Reddit,Comment,Answering question about productivity tools,250,12,0,0,reddit,organic,community,Helpful comment
2025-01-16,Blog,Post,5 Ways floyo Saves Solo Operators 10 Hours Per Week,450,28,15,4,blog,organic,seo,Medium publication
2025-01-17,LinkedIn,Post,Behind-the-scenes: Building floyo as a solo operator,980,38,10,2,linkedin,organic,behind-scenes,Personal story
2025-01-17,Twitter,Post,Just launched floyo on Product Hunt! 🚀,1200,52,18,5,twitter,organic,product-hunt,Product Hunt launch
2025-01-18,Reddit,Post,How I automated my workflow with floyo (honest review),320,18,5,1,reddit,organic,review,User testimonial
2025-01-18,Blog,Post,How floyo Detects Patterns in Your File Usage,380,22,12,3,blog,organic,technical,Dev.to publication
